platform,software_a,software_b,tipo_evento,caso_uso_resumido,titulo_pagina,slug_url,descricao_curta,zap_template_url,passos_resumo,tags
zapier,Google Drive,Slack,Arquivo,Notificação de uploads,Como notificar uploads Google Drive no Slack usando Zapier,google-drive-para-slack-zapier,Receba alertas no Slack para novos arquivos no Google Drive. Colaboração ágil via Zapier.,https://zapier.com/apps/google-drive/integrations/slack,New File in Folder|Format Message|Post to Channel|Share Link,"arquivos,google,slack,zapier"
zapier,Google Drive,Trello,Arquivo,Criação de cards com anexos,Como criar cards Trello com arquivos Google Drive usando Zapier,google-drive-para-trello-zapier,Transforme arquivos Drive em cards Trello automaticamente. Organize projetos via Zapier.,https://zapier.com/apps/google-drive/integrations/trello,New File|Create Card|Attach File|Set Due Date,"arquivos,google,trello,zapier"
zapier,Dropbox,Slack,Arquivo,Alertas de compartilhamento,Como notificar uploads Dropbox no Slack usando Zapier,dropbox-para-slack-zapier,Receba notificações no Slack para novos arquivos Dropbox. Transparência de documentos via Zapier.,https://zapier.com/apps/dropbox/integrations/slack,New File|Format Message|Post to Channel|Add Link,"arquivos,dropbox,slack,zapier"
zapier,Dropbox,Google Drive,Arquivo,Backup cross-cloud,Como fazer backup Dropbox no Google Drive usando Zapier,dropbox-para-google-drive-zapier,Automatize backup de arquivos Dropbox para Google Drive. Redundância via Zapier.,https://zapier.com/apps/dropbox/integrations/google-drive,New File|Download|Upload to Drive|Verify Upload,"arquivos,dropbox,google,zapier"
zapier,Airtable,Slack,Record,Notificação de registros,Como notificar novos registros Airtable no Slack usando Zapier,airtable-para-slack-zapier,Receba alertas no Slack para novos registros Airtable. Dados em tempo real via Zapier.,https://zapier.com/apps/airtable/integrations/slack,New Record|Format Message|Post to Channel|Add Details,"banco-dados,airtable,slack,zapier"
zapier,Airtable,Google Sheets,Record,Sincronização de dados,Como sincronizar Airtable com Google Sheets usando Zapier,airtable-para-google-sheets-zapier,Mantenha Airtable e Sheets sincronizados automaticamente. Análise facilitada via Zapier.,https://zapier.com/apps/airtable/integrations/google-sheets,New/Updated Record|Extract Fields|Append/Update Row|Sync Bidirectional,"banco-dados,airtable,dados,zapier"
zapier,Airtable,Trello,Record,Criação de tasks,Como criar cards Trello a partir de Airtable usando Zapier,airtable-para-trello-zapier,Transforme registros Airtable em cards Trello automaticamente. Gestão visual via Zapier.,https://zapier.com/apps/airtable/integrations/trello,New Record|Map Fields|Create Card|Assign Members,"banco-dados,airtable,trello,zapier"
zapier,Notion,Slack,Database,Notificações de páginas,Como notificar novas páginas Notion no Slack usando Zapier,notion-para-slack-zapier,Receba alertas no Slack para atualizações Notion. Conhecimento compartilhado via Zapier.,https://zapier.com/apps/notion/integrations/slack,New Database Item|Format Message|Post to Channel|Share Link,"documentacao,notion,slack,zapier"
zapier,Notion,Google Calendar,Database,Sincronização de eventos,Como sincronizar banco Notion com Google Calendar usando Zapier,notion-para-google-calendar-zapier,Adicione itens Notion ao Google Calendar automaticamente. Calendário editorial via Zapier.,https://zapier.com/apps/notion/integrations/google-calendar,New Item with Date|Create Event|Set Reminder|Update Notion,"documentacao,notion,calendario,zapier"
zapier,Notion,Trello,Database,Sincronização de projetos,Como sincronizar Notion com Trello usando Zapier,notion-para-trello-zapier,Mantenha databases Notion e boards Trello sincronizados. Flexibilidade total via Zapier.,https://zapier.com/apps/notion/integrations/trello,New/Updated Item|Create/Update Card|Sync Status|Add Links,"documentacao,notion,trello,zapier"
zapier,Telegram,Google Drive,Mensagem,Backup de mídia,Como fazer backup de mídia Telegram no Google Drive usando Zapier,telegram-para-google-drive-backup-midia-zapier,Automatize backup de fotos e vídeos Telegram para Drive. Segurança de conteúdo via Zapier.,https://zapier.com/apps/telegram/integrations/google-drive,New Message with Media|Download File|Upload to Drive|Organize Folder,"comunicacao,telegram,arquivos,zapier"
zapier,Telegram,Trello,Mensagem,Criação de tasks por mensagem,Como criar cards Trello via Telegram usando Zapier,telegram-para-trello-zapier,Transforme mensagens Telegram em cards Trello com comando. Gestão mobile via Zapier.,https://zapier.com/apps/telegram/integrations/trello,New Message (Bot)|Parse Command|Create Card|Send Confirmation,"comunicacao,telegram,trello,zapier"
zapier,Telegram,Slack,Mensagem,Bridge entre plataformas,Como conectar Telegram e Slack usando Zapier,telegram-para-slack-zapier,Sincronize conversas entre Telegram e Slack bidirecionalmente. Comunicação unificada via Zapier.,https://zapier.com/apps/telegram/integrations/slack,New Message|Format Content|Post to Channel|Thread Replies,"comunicacao,telegram,slack,zapier"
zapier,Discord,Trello,Mensagem,Gestão de comunidade,Como criar cards Trello de mensagens Discord usando Zapier,discord-para-trello-zapier,Transforme mensagens Discord em tasks Trello. Organize feedback de comunidade via Zapier.,https://zapier.com/apps/discord/integrations/trello,New Message (Reaction)|Create Card|Add Details|Assign Member,"comunicacao,discord,trello,zapier"
zapier,Discord,Slack,Mensagem,Bridge de servidores,Como sincronizar Discord com Slack usando Zapier,discord-para-slack-zapier,Conecte servidores Discord e workspaces Slack bidirecionalmente. Comunicação sem barreiras via Zapier.,https://zapier.com/apps/discord/integrations/slack,New Message|Format Content|Post to Channel|Mirror Threads,"comunicacao,discord,slack,zapier"
zapier,Twitter,Slack,Tweet,Monitoramento de menções,Como notificar menções Twitter no Slack usando Zapier,twitter-para-slack-zapier,Receba alertas no Slack para menções da marca no Twitter. Social listening via Zapier.,https://zapier.com/apps/twitter/integrations/slack,New Mention|Format Tweet|Post to Channel|Add Link,"social-media,twitter,slack,zapier"
zapier,Twitter,Google Sheets,Tweet,Análise de engajamento,Como registrar tweets no Google Sheets usando Zapier,twitter-para-google-sheets-zapier,Automatize coleta de métricas Twitter em planilhas. Análise de social media via Zapier.,https://zapier.com/apps/twitter/integrations/google-sheets,New Tweet (Search)|Extract Metrics|Append Row|Calculate Stats,"social-media,twitter,dados,zapier"
zapier,LinkedIn,Slack,Post,Monitoramento de posts,Como notificar posts LinkedIn no Slack usando Zapier,linkedin-para-slack-zapier,Receba alertas no Slack para novos posts LinkedIn da empresa. Social media management via Zapier.,https://zapier.com/apps/linkedin/integrations/slack,New Company Post|Format Message|Post to Channel|Track Engagement,"social-media,linkedin,slack,zapier"
zapier,Instagram,Slack,Post,Alertas de publicações,Como notificar posts Instagram no Slack usando Zapier,instagram-para-slack-zapier,Receba notificações no Slack para novos posts Instagram. Gestão de social media via Zapier.,https://zapier.com/apps/instagram/integrations/slack,New Media Posted|Format Message|Post to Channel|Add Metrics,"social-media,instagram,slack,zapier"
zapier,YouTube,Slack,Video,Notificações de uploads,Como notificar uploads YouTube no Slack usando Zapier,youtube-para-slack-zapier,Receba alertas no Slack quando vídeos forem publicados no YouTube. Content tracking via Zapier.,https://zapier.com/apps/youtube/integrations/slack,New Video|Format Announcement|Post to Channel|Add Thumbnail,"social-media,youtube,slack,zapier"
zapier,YouTube,Google Sheets,Video,Análise de performance,Como registrar vídeos YouTube no Google Sheets usando Zapier,youtube-para-google-sheets-zapier,Automatize coleta de métricas YouTube em planilhas. Dashboard de analytics via Zapier.,https://zapier.com/apps/youtube/integrations/google-sheets,New Video|Get Analytics|Append Row|Update Stats Daily,"social-media,youtube,dados,zapier"
zapier,WordPress,Twitter,Post,Auto-post em redes sociais,Como publicar posts WordPress no Twitter automaticamente usando Zapier,wordpress-para-twitter-auto-post-zapier,Automatize divulgação de posts WordPress no Twitter. Aumente alcance via Zapier.,https://zapier.com/apps/wordpress/integrations/twitter,New Post Published|Format Tweet|Add Featured Image|Post to Twitter,"cms,wordpress,social-media,zapier"
zapier,WordPress,Slack,Post,Notificações de publicação,Como notificar posts WordPress no Slack usando Zapier,wordpress-para-slack-zapier,Receba alertas no Slack quando posts WordPress forem publicados. Coordenação editorial via Zapier.,https://zapier.com/apps/wordpress/integrations/slack,New Post|Format Message|Post to Channel|Add Link,"cms,wordpress,slack,zapier"
zapier,WordPress,Mailchimp,Post,Email marketing automático,Como enviar posts WordPress via Mailchimp usando Zapier,wordpress-para-mailchimp-zapier,Automatize envio de newsletters com novos posts WordPress. Engajamento de audiência via Zapier.,https://zapier.com/apps/wordpress/integrations/mailchimp,New Post|Format Campaign|Send to List|Track Opens,"cms,wordpress,email,mailchimp,zapier"
zapier,Webflow,Slack,Form,Notificações de formulários,Como notificar submissões Webflow no Slack usando Zapier,webflow-para-slack-zapier,Receba alertas no Slack para formulários Webflow submetidos. Resposta rápida via Zapier.,https://zapier.com/apps/webflow/integrations/slack,New Form Submission|Format Data|Post to Channel|Mention Team,"cms,webflow,slack,zapier"
zapier,Webflow,Google Sheets,Form,Backup de leads,Como registrar leads Webflow no Google Sheets usando Zapier,webflow-para-google-sheets-zapier,Automatize backup de formulários Webflow em planilhas. Análise de conversão via Zapier.,https://zapier.com/apps/webflow/integrations/google-sheets,New Submission|Extract Fields|Append Row|Track Source,"cms,webflow,dados,zapier"
zapier,Webflow,HubSpot,Form,Captura de leads,Como enviar leads Webflow para HubSpot usando Zapier,webflow-para-hubspot-zapier,Integre formulários Webflow com CRM HubSpot automaticamente. Qualificação de leads via Zapier.,https://zapier.com/apps/webflow/integrations/hubspot,New Submission|Create Contact|Set Lifecycle|Add to List,"cms,webflow,crm,hubspot,zapier"
zapier,Zoom,Google Calendar,Meeting,Sincronização de reuniões,Como sincronizar Zoom com Google Calendar usando Zapier,zoom-para-google-calendar-zapier,Adicione reuniões Zoom ao Google Calendar automaticamente. Nunca perca compromissos via Zapier.,https://zapier.com/apps/zoom/integrations/google-calendar,Meeting Scheduled|Create Event|Add Meeting Link|Set Reminder,"videoconferencia,zoom,calendario,zapier"
zapier,Zoom,Slack,Meeting,Notificações de reuniões,Como notificar reuniões Zoom no Slack usando Zapier,zoom-para-slack-zapier,Receba lembretes no Slack antes de reuniões Zoom. Pontualidade garantida via Zapier.,https://zapier.com/apps/zoom/integrations/slack,Meeting Starting|Format Reminder|Post to Channel|Mention Participants,"videoconferencia,zoom,slack,zapier"
zapier,Zoom,HubSpot,Meeting,Registro de interações,Como registrar reuniões Zoom no HubSpot usando Zapier,zoom-para-hubspot-zapier,Automatize registro de meetings Zoom na timeline HubSpot. Histórico completo via Zapier.,https://zapier.com/apps/zoom/integrations/hubspot,Meeting Ended|Find Contact|Log Activity|Attach Recording,"videoconferencia,zoom,crm,hubspot,zapier"
zapier,Google Meet,Slack,Meeting,Alertas de reuniões,Como notificar reuniões Google Meet no Slack usando Zapier,google-meet-para-slack-zapier,Receba lembretes no Slack para reuniões Google Meet. Time sincronizado via Zapier.,https://zapier.com/apps/google-calendar/integrations/slack,Event Starting (with Meet)|Format Message|Post to Channel|Add Link,"videoconferencia,google,slack,zapier"
zapier,Zendesk,Slack,Ticket,Notificações de suporte,Como notificar tickets Zendesk no Slack usando Zapier,zendesk-para-slack-zapier,Receba alertas no Slack para novos tickets Zendesk. Suporte ágil via Zapier.,https://zapier.com/apps/zendesk/integrations/slack,New Ticket|Format Details|Post to Channel|Assign Agent,"suporte,zendesk,slack,zapier"
zapier,Zendesk,Trello,Ticket,Gestão visual de suporte,Como criar cards Trello para tickets Zendesk usando Zapier,zendesk-para-trello-zapier,Transforme tickets Zendesk em cards Trello automaticamente. Kanban de suporte via Zapier.,https://zapier.com/apps/zendesk/integrations/trello,New Ticket|Create Card|Add Details|Set Priority,"suporte,zendesk,trello,zapier"
zapier,Zendesk,Google Sheets,Ticket,Relatórios de atendimento,Como registrar tickets Zendesk no Google Sheets usando Zapier,zendesk-para-google-sheets-zapier,Automatize relatórios de suporte Zendesk em planilhas. Análise de SLA via Zapier.,https://zapier.com/apps/zendesk/integrations/google-sheets,Ticket Solved|Extract Data|Append Row|Calculate Metrics,"suporte,zendesk,dados,zapier"
zapier,Intercom,Slack,Conversation,Notificações de chat,Como notificar conversas Intercom no Slack usando Zapier,intercom-para-slack-zapier,Receba alertas no Slack para novas conversas Intercom. Suporte distribuído via Zapier.,https://zapier.com/apps/intercom/integrations/slack,New Conversation|Format Message|Post to Channel|Assign Agent,"suporte,intercom,slack,zapier"
zapier,Intercom,HubSpot,Contact,Sincronização de usuários,Como sincronizar Intercom com HubSpot usando Zapier,intercom-para-hubspot-zapier,Mantenha Intercom e HubSpot sincronizados bidirecionalmente. Contexto completo de cliente via Zapier.,https://zapier.com/apps/intercom/integrations/hubspot,New/Updated User|Create/Update Contact|Sync Tags|Log Conversations,"suporte,intercom,crm,hubspot,zapier"
zapier,Freshdesk,Slack,Ticket,Alertas de suporte,Como notificar tickets Freshdesk no Slack usando Zapier,freshdesk-para-slack-zapier,Receba notificações no Slack para tickets Freshdesk urgentes. Resposta rápida via Zapier.,https://zapier.com/apps/freshdesk/integrations/slack,New Ticket (Priority)|Format Message|Post to Channel|Mention Agent,"suporte,freshdesk,slack,zapier"
zapier,Freshdesk,Trello,Ticket,Kanban de atendimento,Como gerenciar tickets Freshdesk no Trello usando Zapier,freshdesk-para-trello-zapier,Visualize tickets Freshdesk em boards Trello automaticamente. Gestão visual via Zapier.,https://zapier.com/apps/freshdesk/integrations/trello,New Ticket|Create Card|Set Labels|Move by Status,"suporte,freshdesk,trello,zapier"
zapier,Facebook Lead Ads,Mailchimp,Lead,Adicionar leads à lista,Como adicionar leads do Facebook Ads no Mailchimp usando Zapier,facebook-lead-ads-para-mailchimp-zapier,Sincronize leads do Facebook com listas Mailchimp automaticamente. Capture e nutra leads com Zapier.,https://zapier.com/apps/facebook-lead-ads/integrations/mailchimp,New Lead|Add to Audience|Tag by Campaign|Send Welcome Email,"marketing,facebook,email,mailchimp,zapier"
zapier,Facebook Lead Ads,HubSpot,Lead,CRM automation,Como enviar leads do Facebook Ads para HubSpot usando Zapier,facebook-lead-ads-para-hubspot-zapier,Automatize captura de leads Facebook no HubSpot. Qualifique e nutra automaticamente com Zapier.,https://zapier.com/apps/facebook-lead-ads/integrations/hubspot,New Lead|Create/Update Contact|Set Lifecycle Stage|Assign to Owner,"marketing,facebook,crm,hubspot,zapier"
zapier,Facebook Lead Ads,Google Sheets,Lead,Backup de leads,Como salvar leads do Facebook Ads no Google Sheets usando Zapier,facebook-lead-ads-para-google-sheets-zapier,Backup automático de leads Facebook em planilhas. Análise de performance via Zapier.,https://zapier.com/apps/facebook-lead-ads/integrations/google-sheets,New Lead|Format Data|Append to Sheet|Calculate Cost per Lead,"marketing,facebook,dados,zapier"
zapier,LinkedIn Lead Gen,Salesforce,Lead,B2B lead capture,Como enviar leads do LinkedIn para Salesforce usando Zapier,linkedin-lead-gen-para-salesforce-zapier,Capture leads B2B do LinkedIn direto no Salesforce. Qualificação automática via Zapier.,https://zapier.com/apps/linkedin-lead-gen/integrations/salesforce,New Lead|Score Lead|Create Lead Record|Assign to Queue,"marketing,linkedin,crm,salesforce,zapier"
zapier,LinkedIn Lead Gen,HubSpot,Lead,B2B marketing,Como integrar LinkedIn Lead Gen com HubSpot usando Zapier,linkedin-lead-gen-para-hubspot-zapier,Automatize leads B2B do LinkedIn para HubSpot. Nutrição e score automáticos via Zapier.,https://zapier.com/apps/linkedin-lead-gen/integrations/hubspot,New Lead|Create Contact|Set Persona|Add to Workflow,"marketing,linkedin,crm,hubspot,zapier"
zapier,Google Ads,Google Sheets,Conversão,ROI tracking,Como registrar conversões Google Ads no Sheets usando Zapier,google-ads-para-google-sheets-zapier,Monitore ROI de Google Ads em planilhas. Dashboard automático via Zapier.,https://zapier.com/apps/google-ads/integrations/google-sheets,New Conversion|Extract Campaign Data|Append Row|Calculate CPA,"marketing,google-ads,dados,zapier"
zapier,Google Ads,Slack,Conversão,Alertas de campanha,Como notificar conversões Google Ads no Slack usando Zapier,google-ads-para-slack-zapier,Receba alertas no Slack para conversões Google Ads. Performance em tempo real via Zapier.,https://zapier.com/apps/google-ads/integrations/slack,New Conversion|Format Stats|Post to Channel|Celebrate Results,"marketing,google-ads,slack,zapier"
zapier,Mailchimp,Google Sheets,Campanha,Email analytics,Como registrar campanhas Mailchimp no Google Sheets usando Zapier,mailchimp-campainha-para-google-sheets-zapier,Automatize relatórios de email marketing em planilhas. Analytics completo via Zapier.,https://zapier.com/apps/mailchimp/integrations/google-sheets,Campaign Sent|Get Open/Click Rates|Append Stats|Track ROI,"marketing,email,mailchimp,dados,zapier"
zapier,ActiveCampaign,Slack,Automação,Marketing alerts,Como notificar automações ActiveCampaign no Slack usando Zapier,activecampaign-para-slack-zapier,Receba alertas de automações ActiveCampaign no Slack. Monitore leads via Zapier.,https://zapier.com/apps/activecampaign/integrations/slack,Automation Completed|Extract Contact Info|Post to Channel|Add Note,"marketing,email,activecampaign,slack,zapier"
zapier,ActiveCampaign,Google Sheets,Contato,Database sync,Como sincronizar contatos ActiveCampaign com Sheets usando Zapier,activecampaign-para-google-sheets-zapier,Backup automático de contatos ActiveCampaign em planilhas. Análise via Zapier.,https://zapier.com/apps/activecampaign/integrations/google-sheets,Contact Updated|Extract Fields|Append/Update Row|Track Engagement,"marketing,email,activecampaign,dados,zapier"
zapier,Shopify,Facebook Pixel,Venda,Conversão tracking,Como enviar vendas Shopify para Facebook Pixel usando Zapier,shopify-para-facebook-pixel-zapier,Automatize tracking de conversões Shopify no Facebook. Otimize campanhas via Zapier.,https://zapier.com/apps/shopify/integrations/facebook,New Order|Extract Purchase Data|Send Conversion Event|Track Revenue,"ecommerce,shopify,marketing,facebook,zapier"
zapier,Shopify,Klaviyo,Cliente,Email marketing,Como sincronizar clientes Shopify com Klaviyo usando Zapier,shopify-para-klaviyo-zapier,Automatize email marketing pós-compra Shopify com Klaviyo. Retenção via Zapier.,https://zapier.com/apps/shopify/integrations/klaviyo,New Customer|Add to List|Trigger Welcome Series|Track LTV,"ecommerce,shopify,email,klaviyo,zapier"
zapier,Shopify,QuickBooks,Pedido,Contabilidade,Como integrar pedidos Shopify com QuickBooks usando Zapier,shopify-para-quickbooks-zapier,Sincronize vendas Shopify com QuickBooks automaticamente. Contabilidade via Zapier.,https://zapier.com/apps/shopify/integrations/quickbooks,New Order|Create Invoice|Record Payment|Sync Inventory,"ecommerce,shopify,financeiro,quickbooks,zapier"
zapier,WooCommerce,Klaviyo,Cliente,Email automation,Como sincronizar WooCommerce com Klaviyo usando Zapier,woocommerce-para-klaviyo-zapier,Automatize campanhas de email WooCommerce com Klaviyo. Maximize LTV via Zapier.,https://zapier.com/apps/woocommerce/integrations/klaviyo,New Customer|Add Profile|Segment by Purchase|Trigger Flow,"ecommerce,woocommerce,email,klaviyo,zapier"
zapier,WooCommerce,QuickBooks,Pedido,Sync financeiro,Como integrar WooCommerce com QuickBooks usando Zapier,woocommerce-para-quickbooks-zapier,Sincronize vendas WooCommerce com contabilidade QuickBooks. Automação via Zapier.,https://zapier.com/apps/woocommerce/integrations/quickbooks,New Order|Create Invoice|Log Payment|Update Inventory,"ecommerce,woocommerce,financeiro,quickbooks,zapier"
zapier,WooCommerce,Facebook Pixel,Venda,Ad tracking,Como rastrear vendas WooCommerce no Facebook Pixel usando Zapier,woocommerce-para-facebook-pixel-zapier,Automatize tracking de conversões WooCommerce no Facebook. ROI via Zapier.,https://zapier.com/apps/woocommerce/integrations/facebook,Order Completed|Format Event|Send to Pixel|Track ROAS,"ecommerce,woocommerce,marketing,facebook,zapier"
zapier,Shopify,Xero,Pedido,Contabilidade,Como sincronizar Shopify com Xero usando Zapier,shopify-para-xero-zapier,Automatize contabilidade Shopify com Xero. Reconciliação automática via Zapier.,https://zapier.com/apps/shopify/integrations/xero,New Order|Create Invoice|Record Payment|Sync to Xero,"ecommerce,shopify,financeiro,xero,zapier"
zapier,BigCommerce,HubSpot,Cliente,CRM ecommerce,Como sincronizar BigCommerce com HubSpot usando Zapier,bigcommerce-para-hubspot-zapier,Integre BigCommerce com CRM HubSpot automaticamente. Marketing unificado via Zapier.,https://zapier.com/apps/bigcommerce/integrations/hubspot,New Customer|Create Contact|Log Purchase|Set Lifecycle,"ecommerce,bigcommerce,crm,hubspot,zapier"
zapier,Etsy,Google Sheets,Pedido,Gestão de vendas,Como registrar vendas Etsy no Google Sheets usando Zapier,etsy-para-google-sheets-zapier,Automatize relatórios de vendas Etsy em planilhas. Dashboard via Zapier.,https://zapier.com/apps/etsy/integrations/google-sheets,New Sale|Extract Order Data|Append Row|Calculate Revenue,"ecommerce,etsy,dados,zapier"
zapier,Square,Mailchimp,Cliente,Email marketing,Como adicionar clientes Square no Mailchimp usando Zapier,square-para-mailchimp-zapier,Sincronize clientes Square com Mailchimp automaticamente. Retenção via Zapier.,https://zapier.com/apps/square/integrations/mailchimp,New Customer|Add to Audience|Tag by Purchase|Trigger Campaign,"ecommerce,square,email,mailchimp,zapier"
zapier,Zendesk,HubSpot,Ticket,Customer 360,Como sincronizar tickets Zendesk com HubSpot usando Zapier,zendesk-para-hubspot-zapier,Unifique suporte Zendesk e CRM HubSpot automaticamente. Customer 360 via Zapier.,https://zapier.com/apps/zendesk/integrations/hubspot,Ticket Solved|Find Contact|Log Activity|Update Support Score,"suporte,zendesk,crm,hubspot,zapier"
zapier,Zendesk,Salesforce,Ticket,Service Cloud sync,Como integrar Zendesk com Salesforce usando Zapier,zendesk-para-salesforce-zapier,Sincronize tickets Zendesk com Salesforce Service Cloud. Dados unificados via Zapier.,https://zapier.com/apps/zendesk/integrations/salesforce,New Ticket|Create Case|Sync Status|Log Resolution,"suporte,zendesk,crm,salesforce,zapier"
zapier,Intercom,Salesforce,Conversa,Sales handoff,Como sincronizar Intercom com Salesforce usando Zapier,intercom-para-salesforce-zapier,Automatize handoff de suporte para vendas Intercom-Salesforce. Contexto via Zapier.,https://zapier.com/apps/intercom/integrations/salesforce,Conversation Tagged|Find Lead|Create Opportunity|Assign Rep,"suporte,intercom,crm,salesforce,zapier"
zapier,Intercom,Slack,Conversa,Internal escalation,Como notificar conversas Intercom prioritárias no Slack usando Zapier,intercom-conversas-prioritarias-para-slack-zapier,Escalone conversas urgentes Intercom para Slack automaticamente. Resposta via Zapier.,https://zapier.com/apps/intercom/integrations/slack,High Priority Conversation|Format Details|Post to Channel|Mention Team,"suporte,intercom,slack,zapier"
zapier,Freshdesk,HubSpot,Ticket,Support CRM sync,Como sincronizar Freshdesk com HubSpot usando Zapier,freshdesk-para-hubspot-zapier,Integre tickets Freshdesk com CRM HubSpot automaticamente. Timeline via Zapier.,https://zapier.com/apps/freshdesk/integrations/hubspot,Ticket Created|Find Contact|Log Activity|Update Properties,"suporte,freshdesk,crm,hubspot,zapier"
zapier,Freshdesk,Salesforce,Ticket,Service integration,Como integrar Freshdesk com Salesforce usando Zapier,freshdesk-para-salesforce-zapier,Sincronize suporte Freshdesk com Salesforce automaticamente. Customer 360 via Zapier.,https://zapier.com/apps/freshdesk/integrations/salesforce,New Ticket|Create Case|Sync Updates|Track CSAT,"suporte,freshdesk,crm,salesforce,zapier"
zapier,Help Scout,Slack,Conversa,Support alerts,Como notificar conversas Help Scout no Slack usando Zapier,help-scout-para-slack-zapier,Receba alertas Slack para conversas Help Scout. Transparência via Zapier.,https://zapier.com/apps/help-scout/integrations/slack,New Conversation|Format Message|Post to Channel|Assign Agent,"suporte,help-scout,slack,zapier"
zapier,Help Scout,HubSpot,Cliente,Support history,Como sincronizar Help Scout com HubSpot usando Zapier,help-scout-para-hubspot-zapier,Unifique histórico de suporte Help Scout no CRM HubSpot. Timeline via Zapier.,https://zapier.com/apps/help-scout/integrations/hubspot,Conversation Closed|Find Contact|Log Activity|Update Score,"suporte,help-scout,crm,hubspot,zapier"
zapier,Gorgias,Shopify,Ticket,Ecommerce support,Como integrar tickets Gorgias com Shopify usando Zapier,gorgias-para-shopify-zapier,Sincronize suporte Gorgias com pedidos Shopify automaticamente. Contexto via Zapier.,https://zapier.com/apps/gorgias/integrations/shopify,Ticket Created|Find Order|Display Order Info|Tag Ticket,"suporte,gorgias,ecommerce,shopify,zapier"
