platform,software_a,software_b,tipo_evento,caso_uso_resumido,titulo_pagina,slug_url,descricao_curta,zap_template_url,passos_resumo,tags
zapier,Drift,Salesforce,Conversa,Chat to CRM,Como sincronizar conversas Drift com Salesforce usando Zapier,drift-para-salesforce-zapier,Automatize captura de leads Drift no Salesforce. Qualificação via Zapier.,https://zapier.com/apps/drift/integrations/salesforce,Conversation Completed|Extract Contact|Create Lead|Assign to SDR,"suporte,drift,crm,salesforce,zapier"
zapier,Calendly,Pipedrive,Agendamento,Meeting to deal,Como criar deals Pipedrive de agendamentos Calendly usando Zapier,calendly-para-pipedrive-zapier,Automatize criação de deals Pipedrive para reuniões Calendly. Pipeline via Zapier.,https://zapier.com/apps/calendly/integrations/pipedrive,New Invitee|Create Person|Create Deal|Set Next Action,"vendas,agendamento,calendly,pipedrive,zapier"
zapier,Calendly,Mailchimp,Agendamento,Follow-up automation,Como enviar follow-ups Mailchimp após Calendly usando Zapier,calendly-para-mailchimp-followup-zapier,Automatize emails pós-reunião Calendly com Mailchimp. Nutrição via Zapier.,https://zapier.com/apps/calendly/integrations/mailchimp,Meeting Completed|Add to List|Tag as Customer|Trigger Campaign,"vendas,agendamento,calendly,email,zapier"
zapier,Gong,Salesforce,Chamada,Call intelligence,Como sincronizar chamadas Gong com Salesforce usando Zapier,gong-para-salesforce-zapier,Automatize insights Gong no Salesforce. Inteligência de vendas via Zapier.,https://zapier.com/apps/gong/integrations/salesforce,Call Recorded|Extract Insights|Log Activity|Update Opportunity,"vendas,gong,crm,salesforce,zapier"
zapier,DocuSign,Salesforce,Contrato,Deal closing,Como atualizar Salesforce quando DocuSign completado usando Zapier,docusign-para-salesforce-zapier,Automatize fechamento de deals Salesforce com DocuSign. Contratos via Zapier.,https://zapier.com/apps/docusign/integrations/salesforce,Envelope Completed|Find Opportunity|Update Stage to Closed Won|Celebrate,"vendas,docusign,crm,salesforce,zapier"
zapier,DocuSign,HubSpot,Contrato,Contract tracking,Como sincronizar DocuSign com HubSpot usando Zapier,docusign-para-hubspot-zapier,Automatize tracking de contratos DocuSign no HubSpot. Deals via Zapier.,https://zapier.com/apps/docusign/integrations/hubspot,Envelope Signed|Update Deal Stage|Log Activity|Send to Team,"vendas,docusign,crm,hubspot,zapier"
zapier,PandaDoc,Salesforce,Proposta,Proposal tracking,Como rastrear propostas PandaDoc no Salesforce usando Zapier,pandadoc-para-salesforce-zapier,Sincronize propostas PandaDoc com Salesforce automaticamente. Pipeline via Zapier.,https://zapier.com/apps/pandadoc/integrations/salesforce,Document Sent|Update Opportunity|Log Activity|Track Status,"vendas,pandadoc,crm,salesforce,zapier"
zapier,PandaDoc,HubSpot,Proposta,Deal tracking,Como integrar PandaDoc com HubSpot usando Zapier,pandadoc-para-hubspot-zapier,Automatize tracking de propostas PandaDoc no HubSpot. Deals via Zapier.,https://zapier.com/apps/pandadoc/integrations/hubspot,Document Completed|Update Deal Stage|Attach to Deal|Notify Rep,"vendas,pandadoc,crm,hubspot,zapier"
zapier,Outreach,Salesforce,Sequência,Sales engagement,Como sincronizar Outreach com Salesforce usando Zapier,outreach-para-salesforce-zapier,Automatize dados de engajamento Outreach no Salesforce. Insights via Zapier.,https://zapier.com/apps/outreach/integrations/salesforce,Prospect Replied|Update Lead Status|Log Activity|Score Lead,"vendas,outreach,crm,salesforce,zapier"
zapier,Calendly,Google Sheets,Agendamento,Meeting analytics,Como registrar agendamentos Calendly no Sheets usando Zapier,calendly-para-google-sheets-analytics-zapier,Automatize relatórios de reuniões Calendly em planilhas. Analytics via Zapier.,https://zapier.com/apps/calendly/integrations/google-sheets,New Event|Extract Details|Append Row|Calculate Show Rate,"vendas,agendamento,calendly,dados,zapier"
zapier,Close,Slack,Deal,Sales notifications,Como notificar deals Close no Slack usando Zapier,close-para-slack-zapier,Receba alertas Slack para atualizações Close CRM. Transparência via Zapier.,https://zapier.com/apps/close/integrations/slack,Opportunity Won|Format Message|Post to Channel|Celebrate Win,"vendas,close,crm,slack,zapier"
zapier,GitHub,Slack,Pull Request,Code review alerts,Como notificar Pull Requests GitHub no Slack usando Zapier,github-pull-request-para-slack-zapier,Receba alertas Slack para PRs GitHub. Acelere code review via Zapier.,https://zapier.com/apps/github/integrations/slack,PR Opened|Format Details|Post to Channel|Mention Reviewers,"desenvolvimento,github,slack,zapier"
zapier,GitHub,Jira,Issue,Bug tracking,Como criar tickets Jira de issues GitHub usando Zapier,github-issues-para-jira-zapier,Sincronize bugs GitHub com Jira automaticamente. Tracking via Zapier.,https://zapier.com/apps/github/integrations/jira,Issue Labeled as Bug|Create Jira Issue|Link to GitHub|Assign to Team,"desenvolvimento,github,jira,zapier"
zapier,GitLab,Slack,Pipeline,CI/CD monitoring,Como notificar pipelines GitLab no Slack usando Zapier,gitlab-pipeline-para-slack-zapier,Monitore CI/CD GitLab no Slack. Deploy alerts via Zapier.,https://zapier.com/apps/gitlab/integrations/slack,Pipeline Failed|Format Error|Post to Channel|Mention On-Call,"desenvolvimento,gitlab,slack,zapier"
zapier,Sentry,Jira,Erro,Error tracking,Como criar tickets Jira de erros Sentry usando Zapier,sentry-para-jira-zapier,Automatize criação de tickets Jira para erros Sentry. Bug tracking via Zapier.,https://zapier.com/apps/sentry/integrations/jira,New Error|Group Similar|Create Issue|Set Priority,"desenvolvimento,sentry,jira,zapier"
zapier,Sentry,Slack,Erro,Error alerts,Como notificar erros Sentry no Slack usando Zapier,sentry-para-slack-zapier,Receba alertas Slack para erros críticos Sentry. Resposta rápida via Zapier.,https://zapier.com/apps/sentry/integrations/slack,Error Threshold Exceeded|Format Details|Post to Channel|Page Team,"desenvolvimento,sentry,slack,zapier"
zapier,PagerDuty,Slack,Incidente,Incident management,Como notificar incidentes PagerDuty no Slack usando Zapier,pagerduty-para-slack-zapier,Automatize alertas de incidentes PagerDuty no Slack. Resposta via Zapier.,https://zapier.com/apps/pagerduty/integrations/slack,Incident Triggered|Format Alert|Post to Channel|Start War Room,"desenvolvimento,pagerduty,slack,zapier"
zapier,Jira,GitHub,Issue,Code linking,Como vincular issues Jira com GitHub usando Zapier,jira-para-github-zapier,Sincronize Jira e GitHub bidirecionalmente. Rastreamento via Zapier.,https://zapier.com/apps/jira/integrations/github,Issue In Progress|Create Branch|Link to Issue|Update Status,"desenvolvimento,jira,github,zapier"
zapier,Linear,Slack,Issue,Project updates,Como notificar issues Linear no Slack usando Zapier,linear-para-slack-zapier,Receba atualizações Linear no Slack automaticamente. Transparência via Zapier.,https://zapier.com/apps/linear/integrations/slack,Issue Updated|Format Change|Post to Channel|Track Progress,"desenvolvimento,linear,slack,zapier"
zapier,Figma,Slack,Arquivo,Design updates,Como notificar atualizações Figma no Slack usando Zapier,figma-para-slack-zapier,Automatize notificações de design Figma no Slack. Colaboração via Zapier.,https://zapier.com/apps/figma/integrations/slack,File Updated|Extract Changes|Post to Channel|Share Link,"design,figma,slack,zapier"
zapier,ProductBoard,Slack,Feature,Product updates,Como notificar features ProductBoard no Slack usando Zapier,productboard-para-slack-zapier,Compartilhe atualizações ProductBoard no Slack automaticamente. Alinhamento via Zapier.,https://zapier.com/apps/productboard/integrations/slack,Feature Released|Format Announcement|Post to Channel|Celebrate,"produto,productboard,slack,zapier"
zapier,BambooHR,Slack,Funcionário,Onboarding alerts,Como notificar novos funcionários BambooHR no Slack usando Zapier,bamboohr-para-slack-zapier,Automatize boas-vindas de novos funcionários BambooHR no Slack. Onboarding via Zapier.,https://zapier.com/apps/bamboohr/integrations/slack,New Employee|Format Welcome|Post to Channel|Assign Buddy,"rh,bamboohr,slack,zapier"
zapier,BambooHR,Google Calendar,Férias,Time off tracking,Como sincronizar férias BambooHR com Google Calendar usando Zapier,bamboohr-para-google-calendar-zapier,Automatize sincronização de férias BambooHR no calendário. Visibilidade via Zapier.,https://zapier.com/apps/bamboohr/integrations/google-calendar,Time Off Approved|Create Event|Set All-Day|Mark as Out of Office,"rh,bamboohr,calendario,zapier"
zapier,Greenhouse,Slack,Candidato,Hiring updates,Como notificar atualizações Greenhouse no Slack usando Zapier,greenhouse-para-slack-zapier,Receba alertas Slack para candidatos Greenhouse. Contratação via Zapier.,https://zapier.com/apps/greenhouse/integrations/slack,Candidate Advanced|Format Update|Post to Channel|Mention Hiring Manager,"rh,greenhouse,slack,zapier"
zapier,Lever,Slack,Candidato,Recruiting alerts,Como notificar candidatos Lever no Slack usando Zapier,lever-para-slack-zapier,Automatize notificações de recrutamento Lever no Slack. Pipeline via Zapier.,https://zapier.com/apps/lever/integrations/slack,New Application|Format Details|Post to Channel|Tag Recruiter,"rh,lever,slack,zapier"
zapier,Gusto,Google Sheets,Folha,Payroll tracking,Como registrar folha Gusto no Google Sheets usando Zapier,gusto-para-google-sheets-zapier,Automatize relatórios de folha Gusto em planilhas. Analytics via Zapier.,https://zapier.com/apps/gusto/integrations/google-sheets,Payroll Run|Extract Data|Append Row|Calculate Totals,"rh,gusto,financeiro,dados,zapier"
zapier,Workday,Slack,Solicitação,Approval workflows,Como notificar aprovações Workday no Slack usando Zapier,workday-para-slack-zapier,Automatize notificações de aprovação Workday no Slack. Agilidade via Zapier.,https://zapier.com/apps/workday/integrations/slack,Approval Pending|Format Request|Post to Channel|Mention Approver,"rh,workday,slack,zapier"
zapier,Expensify,QuickBooks,Despesa,Expense sync,Como sincronizar Expensify com QuickBooks usando Zapier,expensify-para-quickbooks-zapier,Automatize sincronização de despesas Expensify no QuickBooks. Contabilidade via Zapier.,https://zapier.com/apps/expensify/integrations/quickbooks,Report Approved|Create Expense|Record Payment|Sync to QB,"rh,expensify,financeiro,quickbooks,zapier"
zapier,Expensify,Slack,Despesa,Expense alerts,Como notificar despesas Expensify no Slack usando Zapier,expensify-para-slack-zapier,Receba alertas Slack para relatórios Expensify. Aprovação via Zapier.,https://zapier.com/apps/expensify/integrations/slack,Report Submitted|Format Summary|Post to Channel|Request Approval,"rh,expensify,slack,zapier"
zapier,Rippling,Slack,Funcionário,HR notifications,Como notificar eventos Rippling no Slack usando Zapier,rippling-para-slack-zapier,Automatize notificações RH Rippling no Slack. Onboarding e offboarding via Zapier.,https://zapier.com/apps/rippling/integrations/slack,Employee Status Changed|Format Update|Post to Channel|Track Changes,"rh,rippling,slack,zapier"
zapier,15Five,Slack,Check-in,Performance tracking,Como notificar check-ins 15Five no Slack usando Zapier,15five-para-slack-zapier,Automatize notificações de check-ins 15Five no Slack. Engajamento via Zapier.,https://zapier.com/apps/15five/integrations/slack,Check-in Submitted|Extract Highlights|Post to Channel|Celebrate Wins,"rh,15five,slack,zapier"
